jobTitle,company,location,description,remote
Especialista en prevención,Empresa Confidencial,"Santiago Metropolitan Region, Chile","Empresa manufacturera con varias plantas en la RM, se encuentra en búsqueda de un Ingeniero en Prevención de Riesgos que cumpla los siguientes requisitos:• Título de ingeniero en prevención de riesgos.• Experiencia máxima de 2 años.• Disponibilidad para trabajar 100% presencial en Santiago.• Disponibilidad para moverse entre distintas sucursales en la RM Horario: lunes a jueves de 8.00 a 17.30 hrs y viernes de 08:00 a 16.30 hrs. Ofrecemos: estabilidad laboral, contrato directo por la empresa, y desarrollo profesional .",False
Senior Full-Stack Developer (Ruby on Rails/ React) (5600 USD/Mes) [Remote],Listopro a Revelo Company,"Santiago, Santiago Metropolitan Region, Chile","About The Position  We are looking for a motivated software engineer to join our fast growing, agile team. As an early member of the engineering team your contributions will help shape the trajectory of the products and company. You will work alongside the entire technology org (engineering, product, devops / data science), as we believe communication is key to a cohesive and successful product. As a data infrastructure business you will also interact directly with our operations team to ensure our “engine” is always well oiled!  The ideal candidate for this position is someone who loves to code and is continuously curious. They should have strong attention to detail, and a desire to always proudly get their projects over the finish line.  Responsibilities:  Assist in planning of new products and featuresOwn end-to-end products and features through the entire development lifecycleEngage with operations team to understand and remedy customer issuesBuild and manage customer integrations   Required Experience:  Lover of all things code. You’ve woken up in the middle of the night from a dream with the solution to that day’s problemAlways striving to provide end users with an amazing user experiencePassionate about clean, readable, and efficient code4+ years of professional software development experience.   Bonus experiences:  1+ year Ruby on Rails experience1+ year React experienceApolloGraphQLWeb CrawlingDevOps (AWS)  Requirements  None  Benefits  Vacaciones / Flexibilidad de Trabajo  Trabajo Remoto: Globalmente remoto  7568-20102024  ",True
Data Engineer - Snowflake - Senior,Lumenalta (formerly Clevertech),Chile,"Experience Remote done Right. With over 20 years of remote experience, our 500+ team members are 100% remote, and we continue to cultivate vibrant relationships and provide exceptional opportunities for career growth while working with stellar clients on ambitious projects. What we're working on:Enterprise companies turn to us to help them launch innovative digital products that interact with hundreds of millions of customers, transactions, and data points. The challenges we solve daily are real and require creativity, grit, and determination. We are building a culture that challenges norms while fostering experimentation and personal growth. To grasp the scale of the problems we face, ideally, you have some exposure to Logistics, FinTech, Transportation, Insurance, Media, or other complex multifactor industries. Requirements7+ years experience in a senior developer role using Python; ideally, you have delivered business-critical software to large enterprisesYou are comfortable manipulating large data sets and handling raw SQLExperience using technologies such as Snowflake, AWS, and ETL pipelines is essential.Have extensive experience with data warehousing and working with scalability of large volumes of structured dataFinancial Services industry experience preferredEnglish fluency, verbal and writtenPersonality traits: Professional, problem solver, proactive, passionate, team player.  Why Lumenalta is an amazing place to work atAt Lumenalta, you can expect that you will:Be 100% dedicated to one project at a time so that you can innovate and grow.Be a part of a team of talented and friendly senior-level developers.Work on projects that allow you to use leading tech. The result? We produce meaningful outcomes for our clients that break barriers in their industries. The job is 100% Remote; please ensure you have a comfortable office set at your desired work location. Lumenalta is committed to hiring exceptional talent from a wide variety of diverse backgrounds. If you share our values and enthusiasm for digital transformation, we encourage you to apply",True
Tesorero,PAMIN - Passagem Mineração S/A,"Santiago Metropolitan Region, Chile","Accede a tu cuentaRegístrateAccede a tu cuentaRegístrate  La oferta de empleo que buscas ya no existe  Aún tenemos muchas oportunidades, revisa las ofertas relacionadas o haz una nueva búsqueda.  No hay ofertas relacionadas  © Copyright 1999 - 2024. Trabajando.com  Todos los derechos reservados",False
Jefe De Abastecimiento Y Logística FT44rhrs 5x2/ Falabella Rancagua,Falabella,Rancagua Metropolitan Area,"Descripción Empresa  Somos Falabella Retail  Nos gusta innovar, trabajamos desde donde queremos estar, respetamos y valoramos la diversidad, incluimos a todas las personas y derribamos barreras porque acá las diferencias suman.  Disfrutamos y lo pasamos bien trabajando en equipo, aceptando las diferencias por nuestra identidad de género, orientación sexual, creencias religiosas, discapacidad, edad o nacionalidad, compartimos experiencias entre negocios, vibramos con los desafíos del mundo físico y digital.  Somos más de 100 mil personas en 9 países distintos que cada día trabajamos como un equipo por simplificar y disfrutar más la vida.  Funciones Del Cargo  Si te apasiona el Retail, eres motivado y tienes ganas de aprender con los mejores, ¡¡ésta es tu oportunidad para formar parte de un gran equipo y trabajar con nosotros Falabella Rancagua! Buscamos atraer y desarrollar a personal con potencial y que quieran desarrollarse dentro de nuestras tiendas. Queremos desarrollar tu pasión por el cliente y tu capacidad para brindar un servicio excepcional.  OBJETIVO: Administrar la bodega de abastecimiento de la tienda, distribuyendo los productos oportunamente y en el lugar que corresponde, asegurando el cumplimiento de los procedimientos de manipulación de los productos destinados a la tienda.  Dentro De Sus Principales Funciones Se Encuentran   Elaborar informe diario de las unidades de venta del día anterior para apoyar la toma de decisiones con respecto al volumen de mercadería que debe ingresar en el día. Planificar la distribución de turnos y distribuir las tareas del personal de abastecimiento, en la preparación de la mercadería y con el fin de ingresarla a la sala de venta. Controlar y revisar el contenido de los camiones enviados desde Centro de Distribución Disponer y controlar el traslado de la mercadería al lugar correspondiente en la tienda o bodegas de trastienda, según corresponda.  Requisitos  Mayor 18 añosEnseñanza media completaTitulado en Ingeniero en Ejecución Industrial o equivalente  Condiciones Oferta  Descripción proceso de selección:  El proceso de selección se realiza a través de AIRA - plataforma de reclutamiento diseñado para mejorar tu experiencia de postulación.  Para Postular Solo Necesitas   Postular a la oferta Revisar tu mail Ingresar a AIRA y contestar las preguntas y/o pruebas solicitadas  Luego, si vemos que tu perfil se ajusta a lo que estamos buscando, te contactaremos por mail (a través de AIRA) para seguir a la etapa presencial.",False
UX Designer (Google MUI; Figma) (4000 USD/Mes) [Remote],Listopro a Revelo Company,"Santiago, Santiago Metropolitan Region, Chile","About The Position  UX Designer (Google MUI; Figma)  Our Client  GPU Trader is a startup creating a market for unused GPU assets using machine learning  Why our client is hiring for this position/mission  The Client is scaling up the team to finalize the product and make it ready to go on the market.  Team  Small company with 8 members.  Description  Looking for a professional will be responsible for the user interface in their market place (GPU infrastructure to buyers) which is already a work in progress, they need someone to review, analyze and improve it  Collaborate with the engineering team to enhance the user experience for gputrader.io’s GPU marketplace. Create wireframes, prototypes, and high-fidelity designs using Figma and Google MUI. Conduct user research and gather feedback to inform design decisions. Ensure designs meet enterprise-level standards, aligning with AWS/Azure marketplace capabilities. Work closely with the team to maintain project timelines and improve UX efficiency.   Requirements  4+ years of experience as UX Designer. Experience with React.js, HTML, CSS. Strong experience with Figma and Google MUI. Full-time availability preferred, but flexible for exceptional candidates. Experience in B2B SaaS or infrastructure design; e-commerce/social media experience would be a plusStrong communication skills in English, with the ability to collaborate effectively. Proven experience in enterprise-level design and familiarity with design tools such as Figma and Google MUI.   Timezone  Our client accommodates all US timezones, so you can have the flexibility to work within this range  Recruitment Process  Technical Conversation - Panel Interview  Cultural screening  Please notice that changes can happen. Steps could be added/skipped depending on the candidate's performance/team's availability.  Requirements  None  Benefits  Vacaciones / Flexibilidad de Trabajo  Trabajo Remoto: Globalmente remoto  7616-2-20102024  ",True
Ventas Desarrollo de Ingenieria  Válvulas,Nextway S.A. Valves & Automation,"Huechuraba, Santiago Metropolitan Region, Chile",Busqueda de soluciones a mejora operacional,False
RELATORA-Título profesional de las Ciencias Sociales,Cenda Emprendedor,"Chillán Viejo, Ñuble Region, Chile",Company Description: Cenda Emprendedor  Job Description: Cargo: Relator -Facilitador  Perfil: profesionales mujeres con título en Ciencias Sociales (universitario o de instituto profesional reconocido por el Estado) y cursos/diplomados relacionados al género. Las candidatas deberán acreditar su título profesional y la certificación en género mediante los certificados correspondientes. Se valorará experiencia en temas de género y desarrollo rural.,False
Supervisor operaciones turno dia L a V/Falabella Logisitica,Falabella,"San Bernardo, Santiago Metropolitan Region, Chile","Descripción Empresa  Somos más de 100 mil personas que, día a día, dedicamos nuestra pasión y energía a cumplir nuestro Propósito de “Simplificar y Disfrutar Más la Vida”. Propósito que hoy vive a través de nuestro ecosistema físico y digital en todas nuestras empresas (Falabella Retail, Sodimac, IKEA, Tottus, Mallplaza, Falabella Inmobiliario, falabella.com, Linio, Falabella Financiero, Banco Falabella, Falabella Soriana, Seguros Falabella, Fazil, Fpay y Falabella Corporativo) y países (Argentina, Brasil, Chile, China, Colombia, India, México, Perú y Uruguay).  Valoramos las distintas miradas porque entendemos que la diversidad es la clave de nuestra innovación. Queremos ir más allá de cualquier límite, desafiarnos constantemente, divertirnos haciendo lo que nos gusta y dejar huella en lo que hacemos. Y sabemos que existe una forma de hacerlo: como UN SOLO EQUIPO.  Conoce más oportunidades para vivir la #ExperienciaFalabella en https://muevete.falabella.com/  Funciones Del Cargo  Cuando nos preguntan por qué somos la empresa líder en Chile y Latinoamérica la respuesta es simple, es porque nuestros equipos se componen de personas apasionadas con una misión clara: “Simplificar y disfrutar más la vida”  ¡Hoy Falabella Logística está incompleta y buscamos a nuestro próximo talento! Asique si estás en búsqueda de nuevas oportunidades laborales, sigue leyendo, porque esto podría ser para ti…  ¿Te sumas al desafío?  Tus Funciones Serán  Supervisar de manera integral cada una de las actividades que ejecutan sus equipos de trabajo  Controlar los inicios y cierres de turnos.  Controlar los KPI’s del área  Estandarizar los mecanismos de seguridad de las personas, evaluando clima laboral y promoviendo los valores de la compañía Determinar un adecuado estándar de Orden y Aseo en las áreas de trabajo.  Controlar los flujos de los almacenes.  Coordinar entrenamiento constantemente a los equipos de trabajo, aspirando a la excelencia operacional  Participar de las propuestas de mejora continua de la compañía, buscando mejorar nuestra situación actual, de manera colaborativa con las diversas áreas de la compañía  ¿Qué te parece hasta ahora?  Postular Es Simple, Solo Debes   técnico profesional en logística o carreras afines Experiencia previa en áreas de logística Residencia definitiva o temporaria con certificado de respaldo de tramitación de visa definitiva Te consideras una persona muy orientada al cliente, a los resultados y resolución de conflictos.  ¿No logramos convencerte? ¡No te preocupes! Te mostramos algunos de nuestros muchos beneficios (al pasar a contrato indefinido*):   Seguro Complementario de Salud Descuento institucional con tarjeta CMR en tiendas Falabella, Falabella. com, Tottus, Sodimac Convenio con gimnasios y centros de entretenimiento Descuentos en centros educacionales ¡Oportunidades de crecimiento dentro de la empresa!  ¿Qué esperas? Postula aquí y tendrás la oportunidad de ser él o la protagonista de grandes transformaciones.  Se parte del cambio ¡Te esperamos!  Esta oferta laboral se rige bajo la Ley N° 21.015, que incentiva la inclusión de personas con discapacidad al mundo laboral. En caso de que necesites algún ajuste razonable, por favor no dejes de aclararlo en tu postulación.  Requisitos  Experiencia en logisticaTécnico en logística o carreras a fines  Condiciones Oferta  Descripción proceso de selección:  El proceso de selección se realiza a través de AIRA plataforma de reclutamiento diseñado para mejorar tu experiencia de postulación.  Para Postular Solo Necesitas   Postular a la oferta Revisar tu email Ingresar a AIRA y contestar las preguntas y/o pruebas solicitadas  Luego, si vemos que tu perfil se ajusta a lo que estamos buscando, te contactaremos por correo (a través de AIRA) para coordinar una entrevista con nuestro equipo de Atracción de Talento.",False
Mobile Apps Engineer (Swift) (8750 USD/Mes) [Remote],Listopro a Revelo Company,"Santiago, Santiago Metropolitan Region, Chile","About The Position  About Us  As a mobile apps software engineer you’ll share ownership of our development  infrastructure, including (but not limited to) our iOS and Android apps, our  website, our BSS/OSS and CRM customer billing, relationship, and provisioning  software, our Node.js mobile app server architecture, and all other integrations  and dev stacks we utilize.  Day-to-day, there’s a good chance you’ll have more than a few opportunities to show off your creativity, finding solutions for complex problems and leading our  team around or through the many roadblocks that exist in the bureaucratic world of telecommunications.  Key Responsibilities  Leading our development efforts from conception to deployment, working  with engineering, product, and design to constantly rollout updates and  maintain our apps, website, and CRM.  Work with leadership and your dev team colleagues to support building  out our development team, while identifying our next dev phases and  roadmaps.  Making important architectural decisions towards the development stack  and processes for the team and our systems.  Assisting all members of the product and engineering team to implement,  solve, and create amazing user first experiences throughout our product  offerings.  Helping define and implement our development team’s day-to-day  schedules through stand-ups, sprint planning meetings, retrospectives,  and demos.  The “go-to-person” for our technical teams to rely on for leadership,  decisions making, and information.  Solving problems through creativity and communication. Our teams are  remote and a large part of mastering this role will be to improve and help  build our communication across teams and timezones.  Key Languages And Skills  (Swift, Kotlin, TypeScript, Node.js, Express.js, Yaf PHP, and mongoDB) is great.  Our apps rely heavily on Apple Pay and Google Pay to provide a seamless  customer experience, so familiarity with those APIs, past experience  building customer onboarding and billing-focused apps, and knowledge of  merchant-initiated variable-amount recurring billing is beneficial.  Knowledgeable with agile software development practices such as  Kanban and Scrum.  Experiencing managing or working to help lead a technical team in an  agile environment — if you’ve done this in the early stages at a startup  this would be immensely valuable.  You’ll need to juggle, most likely early and almost certainly often, plenty of  projects, tasks, deadlines, fires, ideas, and potentially even a technological  crisis or two10. Being able to zoom in on what matters, even when there  might be a lot of noise, and staying focused through at least some level  of sustained chaos will be a really good skillset to have  Experience supporting cross-functional teams, and understanding the  value of diverse input from stakeholders, with a focus on nurturing growth  and instilling confidence in the team by supporting their growth and  development.  Demonstrated ability to manage through organizational complexity and  ambiguity, show adaptability in the face of chance, and experience  working with teams in a fast paced environment.  Critical decision-making abilities, takes ownership to respond to problems  promptly, with diligent follow-through on areas of responsibility.  Ability to liaise effectively with other departments and leadership to  enhance internal systems, policies, and processes.  Experience working in a Lean-Agile environment for projects and software  development is key.  Experience working in a union environment is an asset.   Requirements  None  Benefits  Vacaciones / Flexibilidad de Trabajo  Trabajo Remoto: Globalmente remoto  5984-20102024  ",True
Senior FullStack Engineer (Python/React) (5333 USD/Mes) [Remote],Listopro a Revelo Company,"Santiago, Santiago Metropolitan Region, Chile","About The Position  Our Client  Our client builds software to transform how people interact with the web, focusing on immersive applications and traditional formats powered by AI. Since 2018, they have pioneered technology across multiple sectors, reaching over 75 million users, and partnering with major global brands.  Why our client is hiring for this position  The company is expanding rapidly and is looking to add talented individuals to support its growth. This is a long-term opportunity for those seeking to contribute to its continued success.  Team  You will be working in a small team, and the company currently has ~50 people.  Requirements  Frontend Skills:  Next.js 14: Experience with App Router for SSR and static web apps. React: Proficient in hooks and component lifecycle. ShadCN: Familiar with component-driven UI development. TypeScript: Strong type safety in React and Next.js.   Backend Skills:  NestJS: Experience with scalable server-side apps. Next.js 14: Backend experience using App Router. Python: Backend development experience. FastAPI: API development experience. TypeScript: Expertise in backend TypeScript development. Prisma ORM: Proficiency with Prisma ORM for database interactions. PostgreSQL: Database design and optimization. Redis: Caching and session management.   General Skills:  RESTful API designGraphQLGitCI/CDAgile methodologies  ﻿  Timezone  Our client accommodates all US timezones, so you can have the flexibility to work within this range  Recruitment Process  TBD  Requirements  None  Benefits  Vacaciones / Flexibilidad de Trabajo  Trabajo Remoto: Globalmente remoto  7625-20102024  ",True
Cloud Security Engineer (AWS) (6000 USD/Mes) [Remote],Listopro a Revelo Company,"Santiago, Santiago Metropolitan Region, Chile","About The Position  WHAT WE SEEK  We are looking for a highly skilled Cloud Security Engineer with expertise in AWS. The ideal candidate will be responsible for ensuring that our cloud computing environment is secure, resilient, and compliant.  You will be a key player in the design, implementation, and management of our AWS-based solutions, ensuring the confidentiality, integrity, and availability of our data and applications  What Your Day Will Look Like  ▪ Provide specialized security advice and support to various teams throughout the company  ▪ Design, build, and implement enterprise-class security systems for a production AWS  environment  ▪ Design and deploy tools, dashboards, scripts, and automation to promote the adoption of secure  configurations by product, application, and development teams  ▪ Align security standards, frameworks, and practices with the overall business and technology  strategy  ▪ Regularly carry out a variety of security assessments, including penetration testing, evaluating  threats and risks, and conducting code reviews  ▪ Identify and communicate current and emerging security threats  ▪ Design security architectures tailored for the AWS environment  ▪ Perform security reviews and audits of AWS services and infrastructure  ▪ Attend to any security incidents including creating playbooks  ▪ Collaborate with colleagues to ensure solutions are effectively engineered, tested, and integrated  ▪ Develop and configure technical solutions, patterns, and new security tools to help mitigate  security vulnerabilities and automate repeatable tasks  ▪ Use metrics and security maturity models to improve our security posture  ▪ Stay informed about the latest industry trends, technologies, and best practices  ▪ Train team members in best practices and provide security guidance  What Should Be In Your Backpack  ▪ Bachelor’s degree in Computer Science, Information Technology, or a related field, or equivalent  Experience  ▪ Strong foundational knowledge in the following security domains: Secure network architectures,  Secure application development, Identity and Access Management, Threat detection and  response, etc.  ▪ Minimum of 3-5 years of experience with Amazon Web Services (AWS). Certifications in AWS, such as AWS Certified Security – Specialty, are a plus  ▪ Familiarity with web-related technologies including Web applications, Web Services, and Service Oriented Architectures, as well as with network/web related protocols.  ▪ Hands-on experience with cloud security solutions such as Security Hub, Guard Duty, WAF, IAM, KMS, VPCs, and Security Groups  ▪ Comprehensive understanding of network-based, system-level, and application layer attacks, along with their mitigation methods  ▪ Strong scripting skills in languages like Python, Bash, etc.  ▪ Experience with security tools such as SIEM, IDS/IPS, and both static and dynamic code analysis, in addition to penetration testing tools  ▪ Proficiency in Cloud Governance, Risk Management, and Compliance  ▪ Experience with conducting vulnerability and risk management activities  ▪ Experience in threat modeling and security architecture reviews  ▪ Champion our Product & Cloud Security program  ▪ Effective communication skills, both written and verbal, with an aptitude for collaboration in a team environment  ▪ Strong analytical and problem-solving skills  Requirements  None  Benefits  Vacaciones / Flexibilidad de Trabajo  Trabajo Remoto: Globalmente remoto  6907-2-20102024  ",True
