jobTitle,company,location,description,remote
Senior Cloud Infrastructure Engineer,Apply Digital,"Santiago, Santiago Metropolitan Region, Chile","About Apply Digital  Apply Digital is a global digital transformation partner for change agents. Leveraging expertise that spans Business Transformation Strategy, Product Design & Development, Commerce, Platform Engineering, Data Intelligence, Change Management, and beyond, we enable our clients to modernize their organizations and deliver meaningful impact to the business and to their customers. Our 650+ team members have helped transform global companies like Kraft Heinz, NFL, Moderna, Lululemon, Games Workshop, Atlassian, and The Very Group. Visit applydigital.com to learn how we can unlock your company’s potential.  If you'd like to learn more about Apply Digital's culture click HERE .  LOCATION: Apply Digital is hybrid/remote-friendly. The preferred candidate should be based in Latin America, preferably working in hours that align to ET (Eastern Timezone) or PT (Pacific Timezone).  Candidates located in Santiago, Chile are able to work out of our Santiago office as remote/hybrid employees. Candidates located outside of Santiago, Chile will be fully remote employees.  THE ROLE:  We are looking for a  Senior Cloud Infrastructure Engineer to design, build, deploy, and manage the infrastructure that our client’s applications run on. This role will be responsible for supporting the technology delivery team in acting as a subject matter expert in cloud infrastructure to architect and then (using Infrastructure as Code platforms) to build and operate app platforms at scale.  Responsibilities:  Design cloud infrastructure components (network, compute, storage, orchestration, security, etc.) based on application architecture and requirements (typically containerized microservice applications). Build and deploy these components using an infrastructure as code platform such as Terraform. Set up CI/CD pipelines. Mentor other team members on good practices and problem resolution. Continuously learn and adapt to new technologies, infrastructure, and frameworks to ensure our systems/processes follow market standards. Be ready to work as the ultimate subject matter expert (SME) during incidents and support the team on resolution and root cause analysis. Have the opportunity to design and implement processes and tools with our team. Work with the latest technologies in the AWS/GCP/Azure and keep your skills current while you innovate. Work in a small team environment within a large, stable, and successful company that is growing fast. Lead the creation of automation and deployments pipelines for applications to all environments. Deploy new and existing applications to production and lower environments as per the release schedule. Investigate and troubleshoot complex issues and help support applications in all environments.   Requirements:  5+ years of Cloud Infrastructure, DevOps, or equivalent experience. Understanding of network topology and creating & organizing secure network communications between different resources in a virtual private cloud (VPC) based on client & security requirements. Understanding of Terraform or another IaC language is a must. Understanding of GCP is required. Experience with building/deploying/managing AWS, GCP, or Azure. Strong experience with CI/CD and tools like Bitbucket, GitHub Actions, and GitLab. Ability to provide expert opinion on infrastructure monitoring tooling and best practices. Experience working with containerized microservice applications. Ability to consult on cost effective solutions for the present, and how they will evolve in the future as needs scale. Knowledge of cloud infrastructure security practices. Ability to analyze metrics from distributed applications to assist in performance tuning and fault finding. Experience with Agile processes, testing, and code review. Strong experience with scripting - shell, Python, etc. Excellent customer service attitude, communication skills (written and verbal), and interpersonal skills. Excellent analytical and problem-solving skills.   Nice to Haves:  Experience with SREAWS Professional CertificationKubernetes CertificationGoogle Cloud CertificationAzure Cloud Certification  LIFE AT APPLY DIGITAL  Great projects:  Broaden your skills on a range of engaging projects with global brands and important work for causes we care about.  An inclusive environment:  We’re truly committed to building a culture where diversity is celebrated and everyone feels welcome. So come as you are.  Learning opportunities:  We offer generous training budgets, including partner tech certifications, custom learning plans, workshops, mentorship, and peer support.  Generous vacation policy:  Work-life balance is key to our team’s success, so we offer ample time away from work to promote overall well-being.  Customizable benefits:  Tailor your extended health and dental plan to your needs, priorities, and preferences.  Flexible work arrangements:  We work in a variety of ways, from remote, to in-office, to a blend of both.  Apply Digital is committed to building a culture where differences are celebrated and everyone feels welcome. That’s why we value equal opportunity and nurture an inclusive workplace where our individual differences are recognized and valued.  For more information, visit the Diversity, Equity, and Inclusion (DEI) section of our website. If you have accommodation needs at this stage of the recruitment process, please inform us as soon as possible by emailing us at careers@applydigital.com .  ",True
(Sr) CTM GenMed,myGwork - LGBTQ+ Business Community,Chile,"This job is with Thermo Fisher Scientific, an inclusive employer and a member of myGwork – the largest global platform for the LGBTQ+ business community. Please do not contact the recruiter directly.    Work Schedule  Standard (Mon-Fri)  Environmental Conditions  Office  Job Description  (Sr) Clinical Team Manager  PPD’s (a part of Thermo Fisher Scientific) mission is to improve health. It starts as an idea to find a cure. It becomes a life saved. All in-between, it’s you! We know that meaningful results not only require the right approach, but also the right people. We invite you to re-imagine health promoting protocols with us, working alongside our talented, bright and energetic teams.  Our Project Delivery team directs, coordinates and manages the technical and operational aspects of projects, securing the successful completion of clinical trials. The team is therapeutically aligned to respond better to our customer needs.  The therapeutic scope includes Cardiovascular & General Medicine- Dermatology, GI, (UC/CD), Cardiovascular, Liver, Nephrology, Immunology, Rare Disease, Diabetes, Obesity, Dyslipidemia, Women's Health, Rheumatology, (RA, SLE, Gout), Cell & Gene Therapy and CAR-T in Autoimmune.  As a (Sr) Clinical Team Manager (CTM), you combine deep knowledge, therapeutic expertise, and robust tools to help our clients deliver life-changing therapies to market. You take ownership, anticipate problems, find solutions and deliver results. You take ownership, anticipate problems, find solutions and deliver results; coordinating the activities of Clinical Management members which are allocated to a project on a Regional or Country basis.  You will work in partnership with the Project Manager to ensure the necessary training, tracking and quality systems are in place for the clinical management team and be primarily responsible for the clinical deliverables of the Project within agreed timelines and budget. Clinical Team Managers provide contact and support to the project sponsor for all clinical aspects.  At PPD we hire the best, develop ourselves and each other, and recognize the power of being one team. We offer continued career advancement opportunities, award winning training and benefits focused on the health and wellbeing of our employees.  Summarized Purpose  Accountable for achieving the final clinical deliverable (usually clean data from evaluable patients as specified in the study protocol) within the time period specified in the contract with the customer. Interprets data on complex issues and makes good business decisions with support from line management. Works to ensure that all clinical deliverables meet the customer's time/quality/cost expectations. Maintains profitability by ensuring clinical activity is conducted within contract scope, through efficient management of the clinical team. Typically works independently on projects of moderate to high complexity and may assume regional lead or Clinical Study Manager responsibilities.  Essential Functions  Manages all clinical operational and quality aspects of allocated studies, of moderate to high complexity, in compliance with ICH GCP. In accordance to project specific requirements, may assume Lead CTM responsibilities on regional level, Clinical Study Manager (CSM) responsibilities or take on additional responsibilities; e.g. process improvements, manage complex programs, have wider management or project coordination responsibilities.Develops clinical tools (e.g. Monitoring Plan, Monitoring Guidelines) in conjunction with the Data Quality Plan. Contributes to the development of the Master Action Plan (MAP) for providing clinical related documents. Ensures timely set up, organization, content and quality of the relevant sections of the Trial Master File (local and central). May participate in the design and development of CRFs, CRF guidelines, patient informed consent templates and other protocol specific documents as required. Collaborates with the project manager to prepare, organize, and present at client meetings, including bid defense and hand-off meetings.Collaborates with the clinical team and other departments as needed to meet deliverables of the project. Regularly communicates with the team and leads team meetings to ensure that timelines, resources, interactions, and quality are maintained. Responsible for the implementation and training of standardized clinical monitoring processes within the study and according to corporate standard policies. Responsible for the timely archiving of documents and study materials for the department.Ensures achievement of the final clinical deliverable within the contractual time period specified by preparing and monitoring clinical activity timelines and metrics, providing status updates to the project manager, regularly reviewing projects using tracking and management tools, implementing recovery actions, reviewing monitoring visit reports, and managing CRF collection and query resolution. Continuously monitors clinical trials to assess performance and ensure contractual obligations are met. May routinely conduct Accompanied Field Visits (AFVs) and be accountable for project financials.Communicates with study sites regarding issues such as protocol, patient participation, case report form completion and other study-related issues.May coordinate all start-up activities and ensures that essential document quality meets the expectation of Regulatory Compliance Review. Ensures timely regulatory submissions (if appropriate) are addressed. Reviews and follows up on all questions raised by ethics committees. Responsibilities may vary based on project timelines. Provides input into preparation of forecast estimates for clinical activities. Responsible for clinical resource management, assignment, delegation of clinical responsibilities and identification of additional resource requirements.   Education And Experience  Bachelor's degree or equivalent and relevant formal academic / vocational qualification Previous experience that provides the knowledge, skills, and abilities to perform the job (comparable to 5+ years). In some cases, an equivalency, consisting of a combination of appropriate education, training and/or directly related experience, will be considered sufficient for an individual to meet the requirements of the role.  Knowledge, Skills And Abilities  Strong leadership skills, effective at mentoring and training, and capable of motivating and integrating teams Strong planning and organizational skills to enable effective prioritization of workload and workload of team members Strong interpersonal and problem-solving skills to enable working in a multicultural matrix organization Solid understanding of change management principles Comprehensive understanding of the practices, processes, and requirements of clinical monitoring Strong judgment, decision making, escalation, and risk management skills Effective oral and written communication skills, including English language proficiency Capable of evaluating own and team members workload against project budget and adjust resources accordingly Strong financial acumen and knowledge of budgeting, forecasting and fiscal management Strong attention to detail In-depth understanding of relevant regulations e.g. ICH/GCP, FDA guidelines, etc. Strong computer skills to effectively use automated systems and computerized applications such as Outlook, Excel, Word, etc. Capable of independently managing clinical only studies   Working Environment  PPD, a part of Thermo Fisher Scientific, values the health and wellbeing of our employees. We support and encourage individuals to create a healthy and balanced environment where they can thrive. Below is listed the working environment/requirements for this role:Able to communicate, receive, and understand information and ideas with diverse groups of people in a comprehensible and reasonable manner.Able to work upright and stationary for typical working hours. Able to work in non-traditional work environments. Able to use and learn standard office equipment and technology with proficiency.Able to perform successfully under pressure while prioritizing and handling multiple projects or activities.May have exposure to potentially hazardous elements typically found in healthcare or laboratory environments. This role requires independent travel up to 20%, inclusive of traveling in automobiles, airplanes, and trains.   Our 4i Values  Integrity – Innovation – Intensity – InvolvementIf you resonate with our 4i values above, and ultimately wish to accelerate the delivery of safe and effective therapeutics for some of the world’s most urgent health needs, submit your application – we’d love to hear from you!",True
Auxiliar de Abastecimiento Falabella Plaza Trebol/ Full time 5x2 rotativo 44 hrs,Falabella,"Talcahuano, Biobío Region, Chile","Descripción Empresa  Somos más de 100 mil personas que, día a día, dedicamos nuestra pasión y energía a cumplir nuestro Propósito de “Simplificar y Disfrutar Más la Vida”. Propósito que hoy vive a través de nuestro ecosistema físico y digital en todas nuestras empresas (Falabella Retail, Sodimac, IKEA, Tottus, Mallplaza, Falabella Inmobiliario, falabella.com, Linio, Falabella Financiero, Banco Falabella, Falabella Soriana, Seguros Falabella, Fazil, Fpay y Falabella Corporativo) y países (Argentina, Brasil, Chile, China, Colombia, India, México, Perú y Uruguay).  Valoramos las distintas miradas porque entendemos que la diversidad es la clave de nuestra innovación. Queremos ir más allá de cualquier límite, desafiarnos constantemente, divertirnos haciendo lo que nos gusta y dejar huella en lo que hacemos. Y sabemos que existe una forma de hacerlo: como UN SOLO EQUIPO.  Conoce más oportunidades para vivir la #ExperienciaFalabella en https://muevete.falabella.com/  Funciones Del Cargo  Cuando nos preguntan por qué somos la empresa de retail líder en Chile y Latinoamérica la respuesta es simple, es porque nuestros equipos se componen de personas apasionadas con una misión clara: “Simplificar y disfrutar más la vida”  ¡Hoy nuestra Tienda de Trebol está incompleta y buscamos a nuestro próximo/a Auxiliar de Abastecimiento! Así que si estás en búsqueda de nuevas oportunidades laborales, sigue leyendo, porque esto podría ser para ti…  El objetivo principal de este cargo es realizar labores de descarga y procesamiento de la mercadería que llega a tienda, de acuerdo a los procedimientos establecidos y a las instrucciones de distribución interna.  ¿Te sumas al desafío?  Tus Funciones Serán   Realizar apertura de rampas de bodega de abastecimiento de la tienda y descargar mercaderías destinadas a tienda, dentro de los horarios establecidos para ello. Hacer reconocimiento de la mercadería vía sensor, verificando la concordancia del número de lotes de productos que llega a la bodega de abastecimiento de la tienda, con el número de productos registrado en la guía de despacho. Efectuar el procesamiento de la mercadería, desprendiendo y eliminando embalajes mayores, para enviar finalmente los productos como unidades a tienda o bodegas de trastienda. Trasladar al piso de ventas todos los productos recibidos. Apoyar en la carga y descarga de las mercaderías destinadas al despacho a domicilio y servicio técnico.  ¿Qué te parece hasta ahora?  Postular Es Simple, Solo Debes   Contar con Certificado de Educación Media Completa. Contar con experiencia en área de Abastecimiento y/o Bodega. Contar con residencia definitiva o temporaria, o con certificado que acredite tramitación de visa definitiva. Suma muchos puntos a tu postulación si tienes experiencia trabajando en Retail y/o Consumo Masivo.  ¿No logramos convencerte? ¡No te preocupes! Te mostramos algunos de nuestros muchos beneficios (al pasar a contrato indefinido*):   Seguro Complementario de Salud Descuento en compras con Tarjeta CMR Institucional Convenio con gimnasios y centros de entretenimiento Descuento en clínicas dentales, oftalmológicas, entre otros. Descuentos en centros educacionales ¡Oportunidades de crecimiento dentro de la empresa!  ¿Qué esperas? Postula aquí y tendrás la oportunidad de ser él o la protagonista de grandes transformaciones.  Se parte del cambio ¡Te esperamos!  Esta oferta laboral se rige bajo la Ley N° 21.015, que incentiva la inclusión de personas con discapacidad al mundo laboral. En caso de que necesites algún ajuste razonable, por favor no dejes de aclararlo en tu postulación.  Requisitos  Ser mayor de 18 añosEnseñanza Media CompletaExperiencia en Abastecimiento, Bodega o Reposición  Condiciones Oferta  Descripción proceso de selección:  El proceso de selección se realiza a través de AIRA plataforma de reclutamiento diseñado para mejorar tu experiencia de postulación.  Para Postular Solo Necesitas   Postular a la oferta Revisar tu email Ingresar a AIRA y contestar las preguntas y/o pruebas solicitadas  Luego, si vemos que tu perfil se ajusta a lo que estamos buscando, te contactaremos por correo (a través de AIRA) para coordinar una entrevista con nuestro equipo de Atracción de Talento.",False
Service Technician Los,Siemens Gamesa,"Los Ángeles, Biobío Region, Chile","It takes the brightest minds to be a technology leader. It takes imagination to create green energy for the generations to come. At Siemens Gamesa we make real what matters, join our global team.  Service Technician Los  It takes the brightest minds to be a technology leader. It takes imagination to create green energy for the generations to come. At Siemens Gamesa we make real what matters, join our global team.  Siemens Gamesa has a vision for renewable energy: we believe in the power of nature and technology. Help us to be ready to face the energy challenges of tomorrow and make a green footprint and join the team in creating a better future for us on our planet.  We focus on hiring the best people, wherever they may be in the world. We pride ourselves on the flexibility we offer to our employees and are committed to building a workforce that can grow with the company. Siemens Gamesa is an equal opportunity employer. We celebrate diversity and are committed to creating an inclusive environment for all employees.  In our culture of trust, we focus on empowerment, diversity, and continuous learning. Valuing our people is what makes us one global team, with our colleagues and safety at the heart of our organization.  We are now recruiting Service technicians to our Hub in Los, Sweden. We are looking for a candidate who is open minded and would appreciate to work on different types of wind turbine platforms and different sites.  How To Contribute To Our Vision  We are looking for you who want a stimulating and varied job, where you will be responsible for service and maintenance of wind turbines at our customers' wind farms.  You get the chance to use your knowledge in electricity and mechanics where you independently solve problems on site to ensure high operational reliability and provide excellent service to our customers.  A great part of the job is ensuring that on-site work is always carried out with safety as the highest priority. For electrical work, we work according to the Swedish electrical standard (SS-EN 50110-1).  You will be supporting our customers both remotely and onsite and coordinate service operations and resolve product issues. This includes carrying out improvement measures and modifications.  You are responsible for reporting and documentation of your work, including supervising, coordinating and follow up jobs performed by subcontractors.  What You Need To Make a Difference  Passion for renewable energy and a sense for the importance to lead the change. We are also looking for someone who has at least a high school education with a technical focus. Education in electricity, hydraulics or mechanics is a huge advantage, as well as experience in wind power. You have a flexible schedule and have a driving license, as you will be driving to our different sites.  If you get offered the position you will be getting a health check and a drug test before you start.  You can communicate clearly both in Swedish and English, and you preferably already live in the area or are ready to move to the region.  In return of your commitment we offer you  Become a part of our mission for sustainability: Clean energy for generations to come. We are a global team of diverse colleagues who share a passion for renewable energy and have a culture of trust and empowerment to make our own ideas a reality. We focus on personal and professional development to grow internally within our organization. We will offer you training in both safety and technical knowledge.  Empowering our people https://www.siemensgamesa.com/sustainability/employees  How do you imagine the future?   https://youtu.be/12Sm678tjuY  Our global team is on the front line of tackling the climate crisis, reducing carbon emissions and the greatest challenge we face.  We believe diversity creates more opportunity for success. That is why we recruit great minds from all walks of life: it does not matter the gender, age, ethnic background, sexual orientation or disability. Our main aim is to find people from around the globe who can contribute to world-changing technology.  Selection is made on an ongoing basis for the position and we are happy to see that you apply today. Your application consists of your CV and a letter in which you justify why you want to become our new colleague.  In accordance with AFS 2019:3, Siemens Gamesa Renewable Energy will carry out a medical examination for height work on the final candidates in the process.  Please note that this position is physically demanding and involves tasks with safety risks requiring a high level of precision. An approved medical/health check, including alcohol and drug testing, is required prior to employment in accordance with company safety policy.  Please apply via the apply button.  If you have specific questions about the position, please contact the hiring manager Mehmet Tugrul, mehmet.tugrul@siemensgamesa.com.  For further information regarding the recruitment process, please send the primary recruiter, Andreas Lindin an email via andreas.lindin.ext@siemensgamesa.com  Please mention the Job ID in the email.  To get in contact with local union representatives: Facket.se@siemens.com  What You Need To Make a Difference  Siemens Gamesa is an equal opportunity employer and maintains a work environment that is free from discrimination and where employees are treated with dignity and respect. Employment at Siemens Gamesa is based solely on an individual's merit and qualifications, which are directly related to job competence. Siemens Gamesa does not discriminate against any employee or job applicant on the basis of race, ethnicity, nationality, ancestry, genetic information, citizenship, religion, age, gender, gender identity/expression, sexual orientation, pregnancy, marital status, disability or any other characteristic protected by applicable laws, rules or regulations. We adhere to these principles in all aspects of employment, including recruiting, hiring, training, compensation, promotion and benefits.     We are driven by people - from more than 100 different countries, they build the company we are every day. Our diverse and inclusive culture encourages us to think outside the box, speak without fear, and be bold. We value the flexibility that our smart-working arrangements, our digital disconnection framework and our family-friendly practices bring to the new way of working.",False
